{
  "$schema": "https://json-schema.org/draft/2020-12/schema",
  "$id": "urn:edgeai:service-execution:v1",
  "title": "SERVICE execution spec v1",
  "description": "Consumer contract for immutable SERVICE Profile.spec. Additional semantic validation: positive resource quantities, requests<=limits, matching resource keys, integer vendor resources, QoS consistency, qualified Kubernetes labels, toleration combinations, compatible node selectors, and combined file budget plus 16MiB <=1GiB. This is not a raw PodSpec. Stream/file port names must be disjoint per direction. Stream work reserve is 6*(maxBufferBytes+maxStateBytes)+32MiB, included in the 1GiB work-volume bound.",
  "type": "object",
  "additionalProperties": false,
  "properties": {
    "apiVersion": {
      "const": "edgeai/v1"
    },
    "image": {
      "type": "string",
      "maxLength": 512,
      "pattern": "^[a-z0-9]+([._:/-][a-z0-9]+)*@sha256:[a-f0-9]{64}$"
    },
    "command": {
      "type": "array",
      "minItems": 1,
      "maxItems": 32,
      "items": {
        "type": "string",
        "maxLength": 4096
      }
    },
    "args": {
      "type": "array",
      "maxItems": 128,
      "items": {
        "type": "string",
        "maxLength": 4096
      }
    },
    "resources": {
      "type": "object",
      "additionalProperties": false,
      "properties": {
        "requests": {
          "type": "object",
          "minProperties": 2,
          "maxProperties": 16,
          "required": [
            "cpu",
            "memory"
          ],
          "additionalProperties": {
            "type": "string",
            "minLength": 1,
            "maxLength": 32
          }
        },
        "limits": {
          "type": "object",
          "minProperties": 2,
          "maxProperties": 16,
          "required": [
            "cpu",
            "memory"
          ],
          "additionalProperties": {
            "type": "string",
            "minLength": 1,
            "maxLength": 32
          }
        }
      },
      "required": [
        "requests",
        "limits"
      ]
    },
    "platform": {
      "type": "object",
      "additionalProperties": false,
      "properties": {
        "os": {
          "const": "linux"
        },
        "architectures": {
          "type": "array",
          "minItems": 1,
          "maxItems": 2,
          "uniqueItems": true,
          "items": {
            "enum": [
              "amd64",
              "arm64"
            ]
          }
        }
      },
      "required": [
        "os",
        "architectures"
      ]
    },
    "inputs": {
      "type": "object",
      "maxProperties": 16,
      "propertyNames": {
        "maxLength": 100,
        "pattern": "^[a-z][a-z0-9]*([._-][a-z0-9]+)*$"
      },
      "additionalProperties": {
        "type": "object",
        "additionalProperties": false,
        "properties": {
          "mediaType": {
            "type": "string",
            "maxLength": 128,
            "pattern": "^[a-z0-9][a-z0-9!#$&^_.+-]*/[a-z0-9][a-z0-9!#$&^_.+-]*$"
          },
          "maxBytes": {
            "type": "integer",
            "minimum": 1,
            "maximum": 268435456
          },
          "required": {
            "type": "boolean"
          }
        },
        "required": [
          "mediaType",
          "maxBytes",
          "required"
        ]
      }
    },
    "outputs": {
      "type": "object",
      "minProperties": 1,
      "maxProperties": 16,
      "propertyNames": {
        "maxLength": 100,
        "pattern": "^[a-z][a-z0-9]*([._-][a-z0-9]+)*$"
      },
      "additionalProperties": {
        "type": "object",
        "additionalProperties": false,
        "properties": {
          "mediaType": {
            "type": "string",
            "maxLength": 128,
            "pattern": "^[a-z0-9][a-z0-9!#$&^_.+-]*/[a-z0-9][a-z0-9!#$&^_.+-]*$"
          },
          "maxBytes": {
            "type": "integer",
            "minimum": 1,
            "maximum": 268435456
          }
        },
        "required": [
          "mediaType",
          "maxBytes"
        ]
      }
    },
    "timeoutSeconds": {
      "type": "integer",
      "minimum": 1,
      "maximum": 86400
    },
    "nodeSelector": {
      "type": "object",
      "maxProperties": 32,
      "additionalProperties": {
        "type": "string",
        "maxLength": 63
      }
    },
    "tolerations": {
      "type": "array",
      "maxItems": 16,
      "items": {
        "type": "object",
        "additionalProperties": false,
        "properties": {
          "key": {
            "type": "string",
            "minLength": 1,
            "maxLength": 317
          },
          "operator": {
            "enum": [
              "Equal",
              "Exists"
            ]
          },
          "value": {
            "type": "string",
            "maxLength": 63
          },
          "effect": {
            "enum": [
              "NoSchedule",
              "PreferNoSchedule",
              "NoExecute"
            ]
          },
          "tolerationSeconds": {
            "type": "integer",
            "minimum": 0,
            "maximum": 86400
          }
        },
        "required": [
          "key",
          "operator",
          "value",
          "effect"
        ]
      }
    },
    "runtimeClassName": {
      "type": "string",
      "minLength": 1,
      "maxLength": 253
    },
    "qos": {
      "enum": [
        "Guaranteed",
        "Burstable"
      ]
    },
    "recovery": {
      "type": "object",
      "additionalProperties": false,
      "required": [
        "mode"
      ],
      "properties": {
        "mode": {
          "type": "string",
          "enum": [
            "NONE",
            "RESTART",
            "CHECKPOINT"
          ],
          "description": "NONE by default. RESTART explicitly declares that this workload may be stopped and restarted from its immutable inputs on a different node without checkpoint restoration. CHECKPOINT is required exclusively for stream specs; state and cursors are externally sealed. Automatic offload support remains gated separately."
        }
      }
    },
    "stream": {
      "type": "object",
      "additionalProperties": false,
      "description": "Persistent stream computation, or an explicit WORKFLOW_DATA producer with no upstream inputs. Root command/args generate final files only after an externally sealed terminal checkpoint and the component completion grant. STREAM execution requires deployment activation.",
      "properties": {
        "source": { "type": "string", "enum": ["WORKFLOW_DATA"] },
        "command": {
          "type": "array",
          "minItems": 1,
          "maxItems": 32,
          "items": {
            "type": "string",
            "maxLength": 4096,
            "minLength": 1,
            "pattern": "^[^\\u0000]*$"
          }
        },
        "args": {
          "type": "array",
          "maxItems": 128,
          "items": {
            "type": "string",
            "maxLength": 4096,
            "minLength": 1,
            "pattern": "^[^\\u0000]*$"
          }
        },
        "inputs": {
          "type": "object",
          "maxProperties": 16,
          "propertyNames": {
            "maxLength": 100,
            "pattern": "^[a-z][a-z0-9]*([._-][a-z0-9]+)*$"
          },
          "additionalProperties": {
            "type": "object",
            "additionalProperties": false,
            "properties": {
              "mediaType": {
                "type": "string",
                "maxLength": 127,
                "pattern": "^[a-z0-9][a-z0-9!#$&^_.+-]*/[a-z0-9][a-z0-9!#$&^_.+-]*$"
              },
              "maxPayloadBytes": {
                "type": "integer",
                "minimum": 1,
                "maximum": 262144
              }
            },
            "required": [
              "mediaType",
              "maxPayloadBytes"
            ]
          }
        },
        "outputs": {
          "type": "object",
          "maxProperties": 16,
          "propertyNames": {
            "maxLength": 100,
            "pattern": "^[a-z][a-z0-9]*([._-][a-z0-9]+)*$"
          },
          "additionalProperties": {
            "type": "object",
            "additionalProperties": false,
            "properties": {
              "mediaType": {
                "type": "string",
                "maxLength": 127,
                "pattern": "^[a-z0-9][a-z0-9!#$&^_.+-]*/[a-z0-9][a-z0-9!#$&^_.+-]*$"
              },
              "maxPayloadBytes": {
                "type": "integer",
                "minimum": 1,
                "maximum": 262144
              }
            },
            "required": [
              "mediaType",
              "maxPayloadBytes"
            ]
          }
        },
        "stepTimeoutSeconds": {
          "type": "integer",
          "minimum": 1,
          "maximum": 3600
        },
        "limits": {
          "type": "object",
          "additionalProperties": false,
          "properties": {
            "maxFrames": {
              "type": "integer",
              "minimum": 1,
              "maximum": 4096
            },
            "maxBufferBytes": {
              "type": "integer",
              "minimum": 1,
              "maximum": 67108864
            },
            "maxStateBytes": {
              "type": "integer",
              "minimum": 1,
              "maximum": 1048576
            }
          },
          "required": [
            "maxFrames",
            "maxBufferBytes",
            "maxStateBytes"
          ]
        }
      },
      "allOf": [{
        "if": {"required": ["source"]},
        "then": {"properties": {
          "command": {"const": ["edgeai-workflow-input"]}, "args": {"maxItems": 0},
          "inputs": {"maxProperties": 0},
          "outputs": {"maxProperties": 1, "required": ["sample"], "properties": {
            "sample": {"properties": {"mediaType": {"const": "application/json"}, "maxPayloadBytes": {"const": 4096}}}
          }}
        }},
        "else": {"properties": {"inputs": {"minProperties": 1}}}
      }],
      "required": [
        "command",
        "args",
        "inputs",
        "outputs",
        "stepTimeoutSeconds",
        "limits"
      ]
    }
  },
  "required": [
    "apiVersion",
    "image",
    "command",
    "args",
    "resources",
    "platform",
    "inputs",
    "outputs",
    "timeoutSeconds"
  ],
  "allOf": [
    {
      "if": {
        "required": [
          "stream"
        ]
      },
      "then": {
        "required": [
          "recovery"
        ],
        "properties": {
          "recovery": {
            "properties": {
              "mode": {
                "const": "CHECKPOINT"
              }
            }
          }
        }
      },
      "else": {
        "properties": {
          "recovery": {
            "properties": {
              "mode": {
                "enum": [
                  "NONE",
                  "RESTART"
                ]
              }
            }
          }
        }
      }
    }
  ]
}
